{
  "schema_version": "apg.closure-ledger/v1",
  "release": "v0.11",
  "owner_phase": "APG138",
  "items": [
    {
      "item_id": "APGR-CI-QUAL",
      "sources": [
        "docs/v0-10-backlog-consolidation.md",
        "docs/v0-9-roadmap.md",
        "docs/architecture/jaca-ci-handoff.md"
      ],
      "inherited_class": "EXTERNAL_GATE",
      "closure_phase": "V0110-C",
      "allowed_outcomes": [
        "DELIVERED",
        "CONSUMER_HANDOFF_CLOSED"
      ],
      "prerequisites": [
        "APGR internal test suites with 80/80 and 85/85 coverage thresholds",
        "JACA Project Onboarding Contract Section 2"
      ],
      "trigger_ref": null,
      "consequence": "Passing CI roles; strict exit code mapping; zero-mutation target path admission; Git drift abort; schema conformance fixtures",
      "status": "CONSUMER_HANDOFF_CLOSED",
      "disposition": {
        "decision_ref": "docs/governance/external/apg140/decisions/APGR-CI-QUAL.json",
        "qualification_refs": [
          "docs/governance/external/apg140/qualification.md",
          "docs/governance/external/apg140/source-inventory.md",
          "docs/governance/external/apg140/decisions.md"
        ],
        "review_ref": "docs/governance/external/apg140/independent-review.md",
        "rationale": "APG140 APGR-CI-QUAL source-bound outcome: CONSUMER_HANDOFF_CLOSED; see item-specific reasoning in decisions.md.",
        "maintenance_ref": null,
        "compatibility_ref": "JACA-CI",
        "maturity_ref": null
      }
    },
    {
      "item_id": "APGR-CXT-BUDGET-COMPRESSION",
      "sources": [
        "docs/v0-10-backlog-consolidation.md",
        "docs/adr/2026/09/0053-v0-10-discovery-capacity-and-svg.md"
      ],
      "inherited_class": "CONDITION_TRIGGERED",
      "closure_phase": "V0110-E",
      "allowed_outcomes": [
        "DELIVERED",
        "MAINTENANCE_TRIGGER"
      ],
      "prerequisites": [
        "Exhaustion of ADR 0053 capacity ceiling (11,507 bytes) or explicit operator rejection of reservation model"
      ],
      "trigger_ref": "APGR-CXT-BUDGET-COMPRESSION",
      "consequence": "Semantic discovery parity tests demonstrating no loss of routing precision across benchmark queries",
      "status": "MAINTENANCE_TRIGGER",
      "disposition": {
        "decision_ref": "docs/governance/maintenance/apg142/decisions/APGR-CXT-BUDGET-COMPRESSION.json",
        "qualification_refs": [
          "docs/adr/2026/09/0055-v0-11-capacity-and-closure-governance.md",
          "docs/governance/maintenance/apg142/context-compression.md",
          "docs/governance/maintenance/apg142/qualification.md"
        ],
        "review_ref": "docs/governance/maintenance/apg142/work-review.md",
        "rationale": "Fresh maintained measurement gives 11,142 UTF-8 description bytes below the unchanged 11,507 ceiling for 45 leaves; the assignment retains the reservation model. Neither accepted branch fires. ADR 0055 status reconciliation remains V0110-F work; no compression or capacity change occurs.",
        "maintenance_ref": "APGR-CXT-BUDGET-COMPRESSION",
        "compatibility_ref": null,
        "maturity_ref": null
      }
    },
    {
      "item_id": "APGR-CXT2B",
      "sources": [
        "docs/v0-10-backlog-consolidation.md",
        "docs/v0-9-roadmap.md"
      ],
      "inherited_class": "OPTIONAL_LATER",
      "closure_phase": "V0110-D",
      "allowed_outcomes": [
        "DELIVERED",
        "REJECTED"
      ],
      "prerequisites": [
        "Pinned Caveman format specification; fail-closed decoding and mapping into APGR footprint schema"
      ],
      "trigger_ref": null,
      "consequence": "Fixture decoding and strict refusal tests on schema mismatch",
      "status": "REJECTED",
      "disposition": {
        "decision_ref": "docs/governance/optional/apg141/decisions/APGR-CXT2B.json",
        "qualification_refs": [
          "docs/governance/optional/apg141/qualification.md",
          "docs/governance/optional/apg141/caveman-decision.md"
        ],
        "review_ref": "docs/governance/optional/apg141/independent-review.md",
        "rationale": "APG141 rejects the optional Caveman adapter after successful dated source and MIT rights inspection: no concrete consumer mapping was demonstrated, and UTF-16 counts or estimated tokens cannot be relabelled as native APGR measures. Existing footprint measurement and explicit imported telemetry meet the established need. This is bounded to inspected contracts; future distinct demand requires a new roadmap item.",
        "maintenance_ref": null,
        "compatibility_ref": null,
        "maturity_ref": null
      }
    },
    {
      "item_id": "APGR-DEBT-CSS-QD-001",
      "sources": [
        "docs/v0-10-backlog-consolidation.md",
        "docs/governance/language-profile-known-debt.json"
      ],
      "inherited_class": "CONDITION_TRIGGERED",
      "closure_phase": "V0110-E",
      "allowed_outcomes": [
        "DELIVERED",
        "MAINTENANCE_TRIGGER"
      ],
      "prerequisites": [
        "Introduce a compact independent source-purpose binding when future TARGET-007 maintenance justifies it."
      ],
      "trigger_ref": "CSS-QD-001",
      "consequence": "Reproduce the recorded consequence, prove the repair at its real boundary, retain source/target semantics and obtain required non-author review.",
      "status": "MAINTENANCE_TRIGGER",
      "disposition": {
        "decision_ref": "docs/governance/maintenance/apg142/decisions/APGR-DEBT-CSS-QD-001.json",
        "qualification_refs": [
          "docs/governance/maintenance/apg142/css-qd-001.md",
          "docs/governance/maintenance/apg142/qualification.md"
        ],
        "review_ref": "docs/governance/maintenance/apg142/work-review.md",
        "rationale": "Public APG77D target-first manifest, scenario fixture and candidate/retention contracts preserve TARGET-007 purpose, source IDs, target identity and source-registry semantics. Later lifecycle metadata does not change those named inputs. Active stable-blocking debt remains.",
        "maintenance_ref": "CSS-QD-001",
        "compatibility_ref": null,
        "maturity_ref": null
      }
    },
    {
      "item_id": "APGR-DEBT-CSS-QD-002",
      "sources": [
        "docs/v0-10-backlog-consolidation.md",
        "docs/governance/language-profile-known-debt.json"
      ],
      "inherited_class": "CONDITION_TRIGGERED",
      "closure_phase": "V0110-E",
      "allowed_outcomes": [
        "DELIVERED",
        "MAINTENANCE_TRIGGER"
      ],
      "prerequisites": [
        "Add an independently frozen disagreement index if the lane mechanism becomes current authority again."
      ],
      "trigger_ref": "CSS-QD-002",
      "consequence": "Reproduce the recorded consequence, prove the repair at its real boundary, retain source/target semantics and obtain required non-author review.",
      "status": "MAINTENANCE_TRIGGER",
      "disposition": {
        "decision_ref": "docs/governance/maintenance/apg142/decisions/APGR-DEBT-CSS-QD-002.json",
        "qualification_refs": [
          "docs/governance/maintenance/apg142/css-qd-002.md",
          "docs/governance/maintenance/apg142/qualification.md"
        ],
        "review_ref": "docs/governance/maintenance/apg142/work-review.md",
        "rationale": "Public APG77D scenario and retention contracts preserve the closed Selection/Response vocabularies and compact authority. Supporting private lane/compact comparisons observe no Lane N, Lane T2 or compact v3 change; those complete private vectors are not publicly reproducible here. The exact refresh is FALSE, independently of the narrower disagreement-index repair threshold. Active stable-blocking debt remains.",
        "maintenance_ref": "CSS-QD-002",
        "compatibility_ref": null,
        "maturity_ref": null
      }
    },
    {
      "item_id": "APGR-DEBT-CSS-QD-003",
      "sources": [
        "docs/v0-10-backlog-consolidation.md",
        "docs/governance/language-profile-known-debt.json"
      ],
      "inherited_class": "CONDITION_TRIGGERED",
      "closure_phase": "V0110-E",
      "allowed_outcomes": [
        "DELIVERED",
        "MAINTENANCE_TRIGGER"
      ],
      "prerequisites": [
        "Add a bounded row/source relation only when a real maintenance workflow needs machine generation or automatic adjudication."
      ],
      "trigger_ref": "CSS-QD-003",
      "consequence": "Reproduce the recorded consequence, prove the repair at its real boundary, retain source/target semantics and obtain required non-author review.",
      "status": "MAINTENANCE_TRIGGER",
      "disposition": {
        "decision_ref": "docs/governance/maintenance/apg142/decisions/APGR-DEBT-CSS-QD-003.json",
        "qualification_refs": [
          "docs/governance/maintenance/apg142/css-qd-003.md",
          "docs/governance/maintenance/apg142/qualification.md"
        ],
        "review_ref": "docs/governance/maintenance/apg142/work-review.md",
        "rationale": "Public APG77D target-first registry, scenario fixture and retention/candidate contracts preserve source, purpose and adjudication authority; lifecycle annotations do not revise it. Private purpose/compact comparisons support the unchanged named rows with limited public reproducibility. The refresh is FALSE independently of machine-generation or automatic-adjudication need. Active stable-blocking debt remains.",
        "maintenance_ref": "CSS-QD-003",
        "compatibility_ref": null,
        "maturity_ref": null
      }
    },
    {
      "item_id": "APGR-DEBT-CSS-QD-004",
      "sources": [
        "docs/v0-10-backlog-consolidation.md",
        "docs/governance/language-profile-known-debt.json"
      ],
      "inherited_class": "CONDITION_TRIGGERED",
      "closure_phase": "V0110-E",
      "allowed_outcomes": [
        "DELIVERED",
        "MAINTENANCE_TRIGGER"
      ],
      "prerequisites": [
        "Add the invariant during the next material route-schema revision."
      ],